{
  "benchmark_name": "QSC-Bench Cold Start",
  "protocol_version": "0.1.0-draft",
  "development_run": true,
  "widths": [4, 8],
  "seeds": [20260813, 20260814],
  "shots": 1024,
  "reference_shots": 8192,
  "latency_seconds": [0.000001, 0.00001, 0.0001, 0.001, 0.1],
  "plant": {
    "coupling_radians": 0.15,
    "nominal_angle_low": 1.30,
    "nominal_angle_high": 1.80,
    "analysis_tilt_radians": 0.40,
    "gain_low": 0.50,
    "gain_high": 1.20,
    "simulator_method": "density_matrix",
    "payload_error_amplification": 3.0,
    "noise": {
      "one_qubit_depolarizing": 0.0002,
      "two_qubit_depolarizing": 0.001,
      "readout_flip": 0.005
    },
    "drift": {
      "initial_shock_rms": 0.45,
      "fast_sigma": 0.002,
      "fast_reversion": 0.05,
      "slow_sigma": 0.0005,
      "common_mode_fraction": 0.0
    }
  },
  "contract": {
    "monitor_rmse_tolerance": 0.025,
    "consecutive_acquisitions": 3,
    "payload_drop_tolerance": 0.03,
    "max_monitor_acquisitions": 24
  },
  "controllers": {
    "names": ["do_nothing", "retained_residual", "diagonal_secant", "commissioned_pi", "dense_fd", "oracle"],
    "include_oracle_in_ranking": false
  }
}
